study,dataset,version,variable,type,template_id,label,label_de,concept,description,description_de,minedition
soep-core,p_statistics,v38.1,age_gr,group,,Age groups,Altersgruppen,geburt,,,
soep-core,p_statistics,v38.1,agre,numerical,,Agreeableness (Big5),Verträglichkeit (Big5),,,,
soep-core,p_statistics,v38.1,bmi,numerical,,Body-Mass-Index,Body-Mass-Index,item_4988,,,
soep-core,p_statistics,v38.1,bula_h,group,,Federal State,Bundesland,bula,,,
soep-core,p_statistics,v38.1,chronill,categorical,,Ever diagnosed a longer-term/chronic illness by a doctor,Jemals längerfristige/chronische Krankheit von Arzt diagnostiziert,pkrno,"This variable is a reverse-coded copy of ple0024 ('No illness'). ple0024 could originally be answered with 'Yes' (No illness) or 'No' (Illness). The item was asked after the following list of illnesses where people could indicate 'Yes' if they had been diagnosed with the respective illness: Sleep disorder (included from 2011 onwards), Diabetes, Asthma, Cardiac disease (also cardiac insufficiency, weak heart), Cancer, Stroke, Migraine, High blood pressure, Depression, Dementia, Joint diseases (including arthritis, rheumatism; included from 2011 onwards), Chronic back trouble (included from 2011 onwards), Burnout (included from 2017 onwards), Thyroid disease (included from 2019 onwards), Other illness.",,
soep-core,p_statistics,v38.1,conc,numerical,,Conscientiousness (Big5),Gewissenhaftigkeit (Big5),,,,
soep-core,p_statistics,v38.1,d11109,numerical,,Number of Years of Education,Number of Years of Education,_pequiv_d11109,,,
soep-core,p_statistics,v38.1,e11103,categorical,,Employment Level of Individual,Beschäftigungsstatus (3-stufig),_pequiv_e11103,,,
soep-core,p_statistics,v38.1,extr,numerical,,Extraversion (Big5),Extraversion (Big5),,,,
soep-core,p_statistics,v38.1,germborn,categorical,,Born in Germany,In Deutschland geboren,germborn,,,
soep-core,p_statistics,v38.1,height,numerical,,Body Height In cm,Body Height in cm,,,,
soep-core,p_statistics,v38.1,hhrf,,,Weighting factor,Hochrechnungsfaktor,,,,
soep-core,p_statistics,v38.1,m11124,categorical,,Disability Status of Individual,Behinderungsstatus,_pequiv_m11124,Disability is here defined as a share of legally attested disability of more than 30%.,,
soep-core,p_statistics,v38.1,m11125,numerical,,Satisfaction with Health,Zufriedenheit mit eigener Gesundheit,_pequiv_m11125,,,
soep-core,p_statistics,v38.1,m11126,categorical,,Current Self-Rated Health Status,Gesundheitszustand,_pequiv_m11126,,,
soep-core,p_statistics,v38.1,migback,group,,Migration background,Migrationshintergrund,migback,,,
soep-core,p_statistics,v38.1,neur,numerical,,Neuroticism (Big5),Neurotizismus (Big5),,,,
soep-core,p_statistics,v38.1,occpos,categorical,,Occupational position,Berufliche Stellung,_pgen_pgstib,,,
soep-core,p_statistics,v38.1,open,numerical,,Openness to experience (Big5),Offenheit (Big5),,,,
soep-core,p_statistics,v38.1,overh,numerical,,Hours of overtime last month,Anzahl Überstunden im letzten Monat,pustd6,"This variable is a copy of plb0197, integrated with plb0196_h. The variable plb0197 is recoded (-2 = 0) for observations where plb0196_h == 0 (Worked overtime? - No).",,
soep-core,p_statistics,v38.1,overyn,categorical,,Worked overtime last month,Überstunden geleistet im letzten Monat,pustd5,"This variable is a copy of plb0196_h, integrated with plb0197. The variable plb0196_h is recoded (-2 = 1) for observations where plb0197 > 0 (Hours of overtime last month > 0).",,
soep-core,p_statistics,v38.1,party,categorical,,Party preference,Parteineigung,ppol3,"Note: from 1998 to 2020,  SOEP interviewers occationally recorded more than one preferred party for some respondents. These cases cannot clearly be assigned to one party or another and were thus subsumed under 'Party combinations'.",,
soep-core,p_statistics,v38.1,pgcasmin,categorical,,Education level (CASMIN Classification),Bildungsniveau (CASMIN-Klassifikation),_pgen_pgcasmin,,,
soep-core,p_statistics,v38.1,pgemplst,categorical,,Employment Status,Beschäftigungsstatus (7-stufig),_pgen_pgemplst,,,
soep-core,p_statistics,v38.1,pgerwzeit,numerical,,Length Of Time With Firm,Dauer der Betriebszugehörigkeit,,,,
soep-core,p_statistics,v38.1,pgfamstd,categorical,,Marital status,Familienstand,_pgen_pgfamstd,"Marital status is describing the institutional status of marriage at the time of the person interview. Marital status is based on information given by the respective person on his or her current relationship as well as on retrospective information about previous relationships asked in the biography questionnaire. Information on marital status when a child was born (provided in the biography information) is not used here, so contradicting information to file BIOBIRTH might still be possible. For those whose partner was identified within the household, marital status is counter-checked with the information given by the partner. Where contradictions can be found, indication of the person information is compiled if reasonable. If no information is available, the indication by position related to head of household is deferred. Remaining contradictions are solved using information on marriage status when a child was born as well as future reports on a given relationship. Marital status is only available for people, who were interviewed. Data on marital status provided here is generated from and hence consistent with the corresponding BIOMARSY file, although value labels differ between PGFAMSTD and SPELLTYP in BIOMARSY. Note that marital status in a specific wave can be different between data distributions due to consistency checks using up-to-date information from following waves. Because of the newly introduced construction process of BIOMARSY, changes might be more than usual. Above, the partner indicator PGPARTZ supplied here in dataset PGEN as well might not match the information provided in PGFAMSTD in its entirety.",,
soep-core,p_statistics,v38.1,pgisced97,group,,ISCED-1997-Classification,ISCED-1997-Klassifikation,,,,
soep-core,p_statistics,v38.1,pglabgro,numerical,,Current Gross Labor Income in Euro,Akt. Bruttoerwerbseink.(gen) in Euro,_pgen_pglabgro,,,
soep-core,p_statistics,v38.1,pglabnet,numerical,,Current Net Labor Income in Euro,Akt. Nettoerwerbseink.(gen) in Euro,_pgen_pglabnet,,,
soep-core,p_statistics,v38.1,pgpsbil,categorical,,School-Leaving Degree,Schulabschluss,,,,
soep-core,p_statistics,v38.1,pgtatzeit,numerical,,Actual Work Time Per Week,Tatsächliche Arbeitszeit pro Woche,_pgen_pgtatzt,This variable provides data on actual weekly working hours (including overtime) for all persons employed at the time of the survey (including the self-employed). The data are obtained by asking respondents how many hours they work on average per week.,"Diese Variable liefert Daten über die tatsächliche Wochenarbeitszeit (einschließlich Überstunden) für alle zum Zeitpunkt der Erhebung beschäftigten Personen (einschließlich der Selbstständigen). Die Daten werden erhoben, indem die Befragten gefragt werden, wie viele Stunden sie im Durchschnitt pro Woche arbeiten.",
soep-core,p_statistics,v38.1,pgvebzeit,numerical,,Agreed Upon Work Time Per Week,Vereinbarte Arbeitszeit pro Woche,_pgen_pgvebzt,,,
soep-core,p_statistics,v38.1,phrf,,,Weighting factor,Hochrechnungsfaktor,,,,
soep-core,p_statistics,v38.1,pid,,,Never Changing Person ID,Unveränderliche Personennummer,,,,
soep-core,p_statistics,v38.1,plb0021,categorical,,Arbeitslos gemeldet,Arbeitslos gemeldet,,,,
soep-core,p_statistics,v38.1,plb0037_h,categorical,,Fixed term/permanent,Befristet/unbefristet [harmonisiert],pbefr1,,,
soep-core,p_statistics,v38.1,plb0050,categorical,,Employees Council At Place Of Work,"Betriebs-, Personalrat in Betrieb",,,,
soep-core,p_statistics,v38.1,plb0111,categorical,,Reason For Employment,"Gründe für Berufstätigkeit, Berufstätigkeit Gründe",,,,
soep-core,p_statistics,v38.1,plb0158,numerical,,"Distance to workplace, in km",Entfernung zum Arbeitsort,,,,
soep-core,p_statistics,v38.1,plb0195_h,categorical,,Compensation for overtime work,Überstunden abgelten [harmonisiert],pustd4,,,
soep-core,p_statistics,v38.1,plb0196_h,categorical,,Worked overtime last month [harmonized],Überstunden letzten Monat [harmonisiert],pustd5,,,
soep-core,p_statistics,v38.1,plb0218_v1,categorical,,Working On Saturday,"Arbeit am Samstag [2005, 2007, 2009-2013, 2015, 2017, 2019, 2021]",paz17,,,
soep-core,p_statistics,v38.1,plb0219_v1,categorical,,Working On Sunday,"Arbeit am Sonntag [2005, 2007, 2009-2013, 2015, 2017, 2019, 2021]",paz18,,,
soep-core,p_statistics,v38.1,plb0240,categorical,,"Gainful Employment, Desire",Erwerbstätigkeit Interesse,,,,
soep-core,p_statistics,v38.1,plb0241_h,numerical,,Desired working hours per week [harmonized],Wochenstunden gewuenscht [harmonisiert],paz14,,,
soep-core,p_statistics,v38.1,plb0417_v2,categorical,,Intend to obtain/resume employment in the future? (unemployed),Zukuenftige Erwerbstaetigkeit beabsichtigt [1994-2021],,,,
soep-core,p_statistics,v38.1,plb0418,categorical,,When would like to start work (again)? (unemployed),Erwerbstaetigkeit Zeitpunkt,,,,
soep-core,p_statistics,v38.1,plb0419_h,categorical,,How easy to find an appropriate position? (unemployed),Geeignete Stelle finden [harmonisiert],,,,
soep-core,p_statistics,v38.1,plb0426,categorical,,Want to keep working in field you were trained in? (unemployed),Erlernter Beruf oder etwas Neues,,,,
soep-core,p_statistics,v38.1,pld0043,categorical,,Frequency lending personal belongings to friends,Hfk. pers. Dinge Freunden verleihen,pbez07,,,
soep-core,p_statistics,v38.1,pld0044,categorical,,Frequency lending money to friends,Hfk. Geld Freunden leihen,pbez08,,,
soep-core,p_statistics,v38.1,pld0045,categorical,,Frequency leaving the door unlocked,Hfk. Tuer unversperrt,pbez09,,,
soep-core,p_statistics,v38.1,pld0047,numerical,,Number of close friends,Anzahl enge Freunde,pbez06,,,
soep-core,p_statistics,v38.1,pld0298_h,categorical,,Sexual orientation,Sexuelle Orientierung [harmonisiert],,,,
soep-core,p_statistics,v38.1,ple0004,categorical,,State Of Health Affects Ascending Stairs,Gesundheitszustand beeintr. Treppen steigen,pges02,,,
soep-core,p_statistics,v38.1,ple0005,categorical,,State Of Health Affects Tiring Tasks,Gesundheitszustand beeintr. Anstreng. Taetigkeiten,pges03,,,
soep-core,p_statistics,v38.1,ple0008,categorical,,Current Health,Gesundheitszustand gegenwärtig,pkilo,,,
soep-core,p_statistics,v38.1,ple0009,categorical,,Limitations In Daily Life Because Of Health Problems,Einschraenkg.im Alltgasleben wg. gesundheitl. Probleme,pges14,,,
soep-core,p_statistics,v38.1,ple0011,categorical,,Sleep Disturbances,Schlafstoerung,pkr23,,,
soep-core,p_statistics,v38.1,ple0012,categorical,,Diabetes,Diabetes,pkr7,,,
soep-core,p_statistics,v38.1,ple0013,categorical,,Asthma,Asthma,pkr8,,,
soep-core,p_statistics,v38.1,ple0014,categorical,,Cardiopathy,Herzkrankheit,pkr9,,,
soep-core,p_statistics,v38.1,ple0015,categorical,,Cancer,Krebserkrankung,pkr10,,,
soep-core,p_statistics,v38.1,ple0016,categorical,,Apoplectic Stroke,Schlaganfall,pkr11,,,
soep-core,p_statistics,v38.1,ple0017,categorical,,Migraine,Migraene,pkr12,,,
soep-core,p_statistics,v38.1,ple0018,categorical,,High Blood Presure,Bluthochdruck,pkr13,,,
soep-core,p_statistics,v38.1,ple0019,categorical,,Depression,Depressive Erkrankung,pkr14,,,
soep-core,p_statistics,v38.1,ple0020,categorical,,Dementia,Demenzerkrankung,pkr15,,,
soep-core,p_statistics,v38.1,ple0021,categorical,,"Joint Disorder (also: Arthrosis, Rheumatism)","Gelenkerkrankungen (auch Arthrose, Rheuma)",pkr24,,,
soep-core,p_statistics,v38.1,ple0022,categorical,,Chronic Back Complaints,Chronische Rueckenbeschwerden,pkr25,,,
soep-core,p_statistics,v38.1,ple0023,categorical,,Other Illness,Sonstige Krankheit,,,,
soep-core,p_statistics,v38.1,ple0040,categorical,,"Legally Handicapped, Reduced Employment",Erwerbsminderung / Schwerbehinderung,pbeh1,,,
soep-core,p_statistics,v38.1,ple0041,numerical,,Degree of disability (in percent),Behinderungsgrad in Prozent,pbeh2,,,
soep-core,p_statistics,v38.1,ple0053,categorical,,Hospital Stay Prev. Year,Krankenhausaufenthalt Vorjahr,pkr1,,,
soep-core,p_statistics,v38.1,ple0055,numerical,,Number Of Hospital Stays Prev. Year,Krankenhausaufenthalt Vorjahr Anzahl,pkr3,,,
soep-core,p_statistics,v38.1,ple0081_h,categorical,,Currently smokes,Rauchen gegenwaertig [harmonisiert],prauch1,,,
soep-core,p_statistics,v38.1,ple0097,categorical,,Type Of Health Insurance,Art der Krankenversicherung,pkv01,,,
soep-core,p_statistics,v38.1,ple0098_v5,categorical,,Supplementary private health insurance,"Private Zusatzversicherung (Ja/Nein) [1999-2008, 2010-2014, 2016, 2018, 2020]",pkv04,,,
soep-core,p_statistics,v38.1,ple0128_h,numerical,,Monthly cost for supplementary private health insurance,Beitrag fuer private Zusatzkrankenversicherung [harmonisiert],pkv05,,,
soep-core,p_statistics,v38.1,ple0162,categorical,,Health Problems for more than 6 Months,Gesundheitliche Probleme laenger als halbes Jahr,pges15,,,
soep-core,p_statistics,v38.1,ple0187,categorical,,Burnout,Ausgebranntsein (Burnout),,,,
soep-core,p_statistics,v38.1,plg0267_h,categorical,,[de] Welche Aus-/Weiterbildung [harmonisiert],Welche Aus-/Weiterbildung [harmonisiert],,,,
soep-core,p_statistics,v38.1,plg0292_h,categorical,,Type of currently received continuing professional development course/retraining,Art der Weiterbildung,,,,
soep-core,p_statistics,v38.1,plh0004,numerical,,"Political attitude (0 = left end, 10 = right end)","Politische Einstellung (0 = ganz links, 10 = ganz rechts)",,,,
soep-core,p_statistics,v38.1,plh0032,categorical,,Worried About Economic Development,Sorgen: Allgemeine wirtschaftliche Entwicklung,psor01,,,
soep-core,p_statistics,v38.1,plh0033,categorical,,Worried About Finances,Sorgen: Eigene wirtschaftliche Situation,psor02,,,
soep-core,p_statistics,v38.1,plh0034,categorical,,worried about stability of financial markets,Sorgen: Stabilität Finanzmärkte,psor13,,,
soep-core,p_statistics,v38.1,plh0035,categorical,,Worried About Own Health,Sorgen: Eigene Gesundheit,psor03,,,
soep-core,p_statistics,v38.1,plh0036,categorical,,Worried About Environment,Sorgen: Umweltschutz,psor04,,,
soep-core,p_statistics,v38.1,plh0037,categorical,,Worried about consequences from climate change,Sorgen: Klimawandelfolgen,psor14,,,
soep-core,p_statistics,v38.1,plh0038,categorical,,Worried About Peace,Sorgen: Friedenserhaltung,psor05,,,
soep-core,p_statistics,v38.1,plh0039,categorical,,Worried About global terrorism,Sorgen: globaler Terrorismus,psor12,,,
soep-core,p_statistics,v38.1,plh0040,categorical,,Worried about crime in Germany,Sorgen: Kriminalitätsentwicklung in Deutschland,psor06,,,
soep-core,p_statistics,v38.1,plh0042,categorical,,Worried About Job Security,Sorgen: Arbeitsplatzsicherheit,psor10,,,
soep-core,p_statistics,v38.1,plh0105,categorical,,Importance: To help Others,Wichtigkeit: Fuer andere da sein,pwich2,,,
soep-core,p_statistics,v38.1,plh0106,categorical,,Importance: to fulfil one's potential,Wichtigkeit: Sich selbst verwirklichen,pwich3,,,
soep-core,p_statistics,v38.1,plh0107,categorical,,Importance: To Have Success In The job,Wichtigkeit: Erfolg im Beruf haben,pwich4,,,
soep-core,p_statistics,v38.1,plh0108,categorical,,Importance: To Have An Own House,Wichtigkeit: Ein eigenes Haus haben,pwich5,,,
soep-core,p_statistics,v38.1,plh0109,categorical,,Importance: To have a happy marriage,"Wichtigkeit: Glueckliche Ehe, Partnerschaft haben",pwich6,,,
soep-core,p_statistics,v38.1,plh0110,categorical,,Importance: To have children,Wichtigkeit: Kinder haben,pwich7,,,
soep-core,p_statistics,v38.1,plh0111,categorical,,Importance: To be socially and politically active,"Wichtigkeit: Sich politisch, gesellschaftlich einsetzen",pwich8,,,
soep-core,p_statistics,v38.1,plh0112,categorical,,Importance: To be able to travel and see the world,"Wichtigkeit: Die Welt sehen, viele Reisen",pwich9,,,
soep-core,p_statistics,v38.1,plh0162,numerical,,Satisfaction With Standard Of Living,Zufriedenheit Lebensstandard,pzuf11,,,
soep-core,p_statistics,v38.1,plh0164,numerical,,Satisfaction With School Education and Vocational Retraining,Zufriedenh. Schul- und Berufsausbildung,pzuf06,,,
soep-core,p_statistics,v38.1,plh0171,numerical,,Satisfaction With Health,Zufriedenheit Gesundheit,pzuf01,,,
soep-core,p_statistics,v38.1,plh0172,numerical,,Satisfaction with sleep,Zufriedenheit Schlaf,pzuf20,,,
soep-core,p_statistics,v38.1,plh0173,numerical,,Satisfaction With Work,Zufriedenheit Arbeit,pzuf02,,,
soep-core,p_statistics,v38.1,plh0174,numerical,,Satisfaction With Housework,Zufriedenheit HH-Taetigk.,pzuf03,,,
soep-core,p_statistics,v38.1,plh0175,numerical,,Satisfaction With Household Income,Zufriedenheit HH-Einkommen,pzuf04,,,
soep-core,p_statistics,v38.1,plh0176,numerical,,Satisfaction With Personal Income,Zufriedenheit mit persoenlichem Einkommen,pzuf05,,,
soep-core,p_statistics,v38.1,plh0177,numerical,,Satisfaction With Dwelling,Zufriedenheit Wohnung,pzuf07,,,
soep-core,p_statistics,v38.1,plh0178,numerical,,Satisfaction With Amount Of Leisure Time,Zufriedenheit Freizeit,pzuf08,,,
soep-core,p_statistics,v38.1,plh0179,numerical,,Satisfaction With Child Care,Zufriedenheit Kinderbetreuung,pzuf09,,,
soep-core,p_statistics,v38.1,plh0180,numerical,,Satisfaction with family life,Zufriedenheit Familienleben,pzuf13,,,
soep-core,p_statistics,v38.1,plh0181,numerical,,Satisfaction With Social Life,"Zufriedenheit Freundes-, Bekanntenkreis",pzuf14,,,
soep-core,p_statistics,v38.1,plh0182,numerical,,Current Life Satisfaction,Lebenszufriedenheit gegenwaertig,pzule1,,,
soep-core,p_statistics,v38.1,plh0183,numerical,,Satisfaction With Life Five Years From Now,Lebenszufriedenheit in 5 Jahren,pzule2,,,
soep-core,p_statistics,v38.1,plh0184,categorical,,Frequency of being angry in the last 4 weeks,Haeufigkeit aergerlich letzte 4 Wochen,pgef1,,,
soep-core,p_statistics,v38.1,plh0185,categorical,,Frequency of being worried in the last 4 weeks,Haeufigkeit aengstlich letzte 4 Wochen,pgef2,,,
soep-core,p_statistics,v38.1,plh0186,categorical,,Frequency of being happy in the last 4 weeks,Haeufigkeit gluecklich letzte 4 Wochen,pgef3,,,
soep-core,p_statistics,v38.1,plh0187,categorical,,Frequency of being sad in the last 4 weeks,Haeufigkeit traurig letzte 4 Wochen,pgef4,,,
soep-core,p_statistics,v38.1,plh0188,categorical,,Confident About Future,Sehe Zukunft zuversichtlich,psti1,,,
soep-core,p_statistics,v38.1,plh0189,categorical,,Lonely,Fuehle micht oft einsam,psti2,,,
soep-core,p_statistics,v38.1,plh0190,categorical,,Do Not Enjoy Work,Keine Freude an der Arbeit,psti3,,,
soep-core,p_statistics,v38.1,plh0191,categorical,,Barely Able To Cope With Things,Verhaeltnisse so kompliziert heute,psti4,,,
soep-core,p_statistics,v38.1,plh0192,categorical,,On The Whole Trust People,Allg. Vertrauen,pbez01,,,
soep-core,p_statistics,v38.1,plh0193,categorical,,Nowadays Can't Trust Anyone,Heute kein Verlass auf niemand,pbez02,,,
soep-core,p_statistics,v38.1,plh0194,categorical,,"When dealing with strangers, it's better to be careful before trusting them.",Vorsicht gegenueber Fremden,pbez03,,,
soep-core,p_statistics,v38.1,plh0195,categorical,,Are most people exploitive or fair?,"Leute nutzen aus, sind fair",pbez04,,,
soep-core,p_statistics,v38.1,plh0196,categorical,,Are most people helpful or self-serving?,"Leute hilfsbereit, Eigeninteresse",pbez05,,,
soep-core,p_statistics,v38.1,plh0204_h,numerical,,Willingness to take risks,Selbsteinschaetzung Risikobereitschaft [harmonisiert],prisk,,,
soep-core,p_statistics,v38.1,plh0206i01,numerical,,I Return Favors,Bereitschaft Gefallen zu erwidern,1991,,,
soep-core,p_statistics,v38.1,plh0206i02,numerical,,I Take Revenge If I Suffer Serious Wrong,Rache bei schwerem Unrecht,1992,,,
soep-core,p_statistics,v38.1,plh0206i03,numerical,,Payback: Put someone in Difficult Position,Heimzahlen / in schwierige Lage bringen,1993,,,
soep-core,p_statistics,v38.1,plh0206i04,numerical,,Go Out Of My Way To Help Somebody,Besondere Anstrengung Hilfe zurueckzugeben,1994,,,
soep-core,p_statistics,v38.1,plh0206i05,numerical,,"when Offended, Offend Back",Beleidigendes Verh. bei Beleidigungen,1995,,,
soep-core,p_statistics,v38.1,plh0206i06,numerical,,Undergo Costs to Help Somebody Who Helped Before,Bereitschaft Kosten aufzunehmen um Hilfe zurueckzugeben,1996,,,
soep-core,p_statistics,v38.1,plh0244,categorical,,Attitude towards future,Einstellung bezueglich Zukunft,,,,
soep-core,p_statistics,v38.1,plh0258_h,categorical,,Affiliation with a church or religious community,"Kirche, Religion [harmonisiert]",,,,
soep-core,p_statistics,v38.1,pli0007_h,numerical,,"Sundays, hours spent for: Work","Beruf, Lehre, Nebenerw.Std., Sonntag [harmonisiert]",,,,
soep-core,p_statistics,v38.1,pli0010,numerical,,"Sundays, hours spent for: Leisure, Hobbies","Hobbies, Freizeit Std., So",,,,
soep-core,p_statistics,v38.1,pli0016_h,numerical,,"Sundays, hours spent for: Housework","Hausarbeit Std., Sonntag [harmonisiert]",,,,
soep-core,p_statistics,v38.1,pli0022_h,numerical,,"Sundays, hours spent for: Childcare","Kinderbetreuung Std., Sonntag [harmonisiert]",,,,
soep-core,p_statistics,v38.1,pli0028_h,numerical,,"Sundays, hours spent for: Professional training, education","Aus- u. Weiterb., Lernen Std., Sonntag [harmonisiert]",,,,
soep-core,p_statistics,v38.1,pli0038_h,numerical,,"Weekdays, hours spent for: Work","Beruf, Lehre, Nebenerw. Std., Werktg. [harmonisiert]",,,,
soep-core,p_statistics,v38.1,pli0043_h,numerical,,"Weekdays, hours spent for: Housework","Hausarbeit Std., Werktg. [harmonisiert]",,,,
soep-core,p_statistics,v38.1,pli0044_h,numerical,,"Weekdays, hours spent for: Childcare","Kinderbetreuung Std., Werktg. [harmonisiert]",,,,
soep-core,p_statistics,v38.1,pli0046,numerical,,"Weekdays, hours spent for: Support person requiring care","Versorgung Pflegebeduerftiger, Werktg.",,,,
soep-core,p_statistics,v38.1,pli0047_h,numerical,,"Weekdays, hours spent for: Professional training, education","Stunden pro Werktag für: Aus-/Weiterbildung, Studium",,,,
soep-core,p_statistics,v38.1,pli0051,numerical,,"Weekdays, hours spent for: Leisure, Hobbies","Hobbies, Freizeit Std., Werktg.",,,,
soep-core,p_statistics,v38.1,pli0057,numerical,,"Sundays, hours spent for: Support person requiring care","Versorgung Pflegebeduerftiger, Sonntag",,,,
soep-core,p_statistics,v38.1,pli0059,numerical,,"Hours of sleep, normal workday","Stunden Schlaf, normaLer Werktag",pschl1,,,
soep-core,p_statistics,v38.1,pli0060,numerical,,"Hours of sleep, weekend","Stunden Schlaf, am Wochenende",,,,
soep-core,p_statistics,v38.1,pli0079,categorical,,Frequency going out for dinner or drinks,"Essen,trinken gehen",,,,
soep-core,p_statistics,v38.1,pli0080,categorical,,"Frequency visiting/being visited by neightbors, friends","Besuche Nachbarn,Freunde",pfrei02,,,
soep-core,p_statistics,v38.1,pli0081,categorical,,"Frequency visiting/being visited by family, relatives","Besuche Familie,Verwandte",pfrei03,,,
soep-core,p_statistics,v38.1,pli0082,categorical,,Frequency going on excursions/short trips,"Ausfluege,Kurzreisen",pfrei04,,,
soep-core,p_statistics,v38.1,pli0083,categorical,,Frequency watching television/movies/series,"Fernsehen, Video",pfrei08,,,
soep-core,p_statistics,v38.1,pli0089,categorical,,Frequency going to sporting events,Besuch von Sportveranstaltung,pfrei15,,,
soep-core,p_statistics,v38.1,pli0091_h,categorical,,"Frequency going to the cinema, pop or jazz concerts, dance events, discos","Besuch von Kino,Pop,Jazz Konzerte,Disco [harmonisiert]",pfrei16,,,
soep-core,p_statistics,v38.1,pli0092_h,categorical,,Frequency taking part in sports,Aktiver Sport [harmonisiert],_pequiv_m11104,,,
soep-core,p_statistics,v38.1,pli0093_h,categorical,,Frequency of artistic or musical activities,Kuenstlerische und musische Taetigkeiten [harmonisiert],pfrei11,,,
soep-core,p_statistics,v38.1,pli0094_h,categorical,,"Frequency meeting with friends, relatives or neighbors","Geselligkeit m. Freund., Verwandt. [harmonisiert]",,,,
soep-core,p_statistics,v38.1,pli0095_h,categorical,,"Frequency helping friends, relatives","Mithelfen bei Freund., Verwandt. [harmonisiert]",pfz6,,,
soep-core,p_statistics,v38.1,pli0096_h,categorical,,Frequency of volunteer work,"Ehrenamtliche Taetigkeit in Vereinen, Verbaenden, … [harmonisiert]",pfrei06,,,
soep-core,p_statistics,v38.1,pli0097_h,categorical,,"Frequency participating in polit. parties, local politics, citizens' initiatives","Beteilig. Parteien, Kommunalpolitik, Buergerinitiativen [harmonisiert]",pfrei05,,,
soep-core,p_statistics,v38.1,pli0098_h,categorical,,"Frequency going to church, attending religious events","Kirchgang, Besuch religioeser Veranstaltungen [harmonisiert]",pfrei07,,,
soep-core,p_statistics,v38.1,pli0165,categorical,,Frequency using online social networks,Nutzen sozialer Online-Netzwerke,6044,,,
soep-core,p_statistics,v38.1,plj0021_h,categorical,,Intend To Apply For German Citizenship,Beantragung deutsche Staatsangeh [harmonisiert],,,,
soep-core,p_statistics,v38.1,plj0024_h,categorical,,German nationality since when,Zeitpunkt Erwerb deutscher Staatsangehoerigkeit [harmonisiert],,,,
soep-core,p_statistics,v38.1,plj0045,categorical,,Could imagine moving to other part of Germany (East/West)?,Umzug nach West-/Ostdeutschland moeglich?,,,,
soep-core,p_statistics,v38.1,plj0046,categorical,,Worried About Immigration To Germany,Sorgen Zuwanderung,psor08,,,
soep-core,p_statistics,v38.1,plj0047,categorical,,Worried About Hostility To Foreigners,Sorgen: Auslaenderfeindlichkeit,psor09,,,
soep-core,p_statistics,v38.1,plj0078,categorical,,Feel German,Als Deutscher fuehlen,,,,
soep-core,p_statistics,v38.1,plj0080_h,categorical,,Feel connected to country of origin,Gefühlte Verbundenheit zum Heimatland,,,,
